Name,Price,Image
Transportin Vari Kennel para Perro Homologado IATA - Pequeño,51.45,http://www.petsonic.com/es/7828-large_default/petmate-transportin-vari-kennel.jpg
Transportin Vari Kennel para Perro Homologado IATA - Mediano,64.95,http://www.petsonic.com/es/7828-large_default/petmate-transportin-vari-kennel.jpg
Transportin Vari Kennel para Perro Homologado IATA - Grande,115.75,http://www.petsonic.com/es/7828-large_default/petmate-transportin-vari-kennel.jpg
Transportin Vari Kennel para Perro Homologado IATA - Extra Grande,121.45,http://www.petsonic.com/es/7828-large_default/petmate-transportin-vari-kennel.jpg
Transportin Vari Kennel para Perro Homologado IATA - Gigante,262.45,http://www.petsonic.com/es/7828-large_default/petmate-transportin-vari-kennel.jpg
Transportin Vari Kennel para Perro Homologado IATA - Intermedio,89.95,http://www.petsonic.com/es/7828-large_default/petmate-transportin-vari-kennel.jpg
Transportin Visión para Perro y Gato Colores Surtidos Homologado IATA - 50 cm,17.45,http://www.petsonic.com/es/7831-large_default/transportin-vision-para-perro-y-gato-colores-surtidos.jpg
Transportin Visión para Perro y Gato Colores Surtidos Homologado IATA - 60 cm,23.95,http://www.petsonic.com/es/7831-large_default/transportin-vision-para-perro-y-gato-colores-surtidos.jpg
Transportin Gulliver para Perro Homologado IATA - Gulliver 3 ( 61x40x38cm ),26.95,http://www.petsonic.com/es/7832-large_default/transportin-gulliver-iata-tamano-4567.jpg
Transportin Gulliver para Perro Homologado IATA - Gulliver 4 ( 71x51x50cm ),52.95,http://www.petsonic.com/es/7832-large_default/transportin-gulliver-iata-tamano-4567.jpg
Transportin Gulliver para Perro Homologado IATA - Gulliver 5 ( 81x61x60cm ),67.45,http://www.petsonic.com/es/7832-large_default/transportin-gulliver-iata-tamano-4567.jpg
Transportin Gulliver para Perro Homologado IATA - Gulliver 6 ( 92x64x66cm ),85.40,http://www.petsonic.com/es/7832-large_default/transportin-gulliver-iata-tamano-4567.jpg
Transportin Gulliver para Perro Homologado IATA - Gulliver 7 ( 102x72x76cm ),95.85,http://www.petsonic.com/es/7832-large_default/transportin-gulliver-iata-tamano-4567.jpg
Transportín IATA para Perro/Gato - 51x33x30 cm,19.95,http://www.petsonic.com/es/10727-large_default/transportin-iata-para-perrogato.jpg
Transportin Gulliver Puerta Plástico para Perros y Gatos - Gulliver 2 ( 55x36x35cm ),12.95,http://www.petsonic.com/es/7829-large_default/transportin-gulliver-para-perros-y-gatos.jpg
Transportin Gulliver Puerta Plástico para Perros y Gatos - Gulliver 3 ( 61x40x38cm ),22.60,http://www.petsonic.com/es/7829-large_default/transportin-gulliver-para-perros-y-gatos.jpg
Transportin Gulliver 3 puerta Metálica para Perro y/o Gato - Gris Claro,26.95,http://www.petsonic.com/es/6475-large_default/transportin-gulliver-tamano-123.jpg
Transportin Gulliver 3 puerta Metálica para Perro y/o Gato - Gris Oscuro,26.95,http://www.petsonic.com/es/6475-large_default/transportin-gulliver-tamano-123.jpg
Transportin Trotter para Perro y/o Gato Color Antracita - Troter 1 (49 x 33 x 30cm),12.60,http://www.petsonic.com/es/3106-large_default/savic-transportin-trotter-antracita.jpg
Transportin Trotter para Perro y/o Gato Color Antracita - Trotter 2 (56 x 37.5 x 33cm),27.95,http://www.petsonic.com/es/3106-large_default/savic-transportin-trotter-antracita.jpg
Transportin Trotter para Perro y/o Gato Color Antracita - Trotter 3 (60.5 x 40.5 x 39cm),32.30,http://www.petsonic.com/es/3106-large_default/savic-transportin-trotter-antracita.jpg
Transportin Pet Carrier para Perro - 77x43x51 cm,38.22,http://www.petsonic.com/es/9573-large_default/transportin-pet-carrier-para-perro.jpg
Transportin Pet Carrier para Perro - 89x60x51 cm ,41.97,http://www.petsonic.com/es/9573-large_default/transportin-pet-carrier-para-perro.jpg
Transportin Pet Carrier para Perro - 100x60x65 cm,64.75,http://www.petsonic.com/es/9573-large_default/transportin-pet-carrier-para-perro.jpg
Ruedas Gulliver 4-5-6 y 7 IATA - 4 Unidades.,29.13,http://www.petsonic.com/es/3427-large_default/trixie-ruedas-gulliver-4-5-6-y-7-iata.jpg
Transportin Trotter para Perro y/o Gato Color Verde - Troter 1 (49 x 33 x 30cm),14.95,http://www.petsonic.com/es/6474-large_default/transportin-trotter-para-perro-yo-gato-color-verde.jpg
Transportin Trotter para Perro y/o Gato Color Verde - Trotter 3 (60.5 x 40.5 x 39cm),32.50,http://www.petsonic.com/es/6474-large_default/transportin-trotter-para-perro-yo-gato-color-verde.jpg
Transportin Trotter para Perro y/o Gato Color Azul - Trotter 3 (60.5 x 40.5 x 39cm),32.30,http://www.petsonic.com/es/3108-large_default/nayeco-transportin-trotter-azul.jpg
Nayeco Transportín Pegaso - Colores variados,5.75,http://www.petsonic.com/es/4141-large_default/nayeco-pegaso-transportin-para-perros-y-gatos-petsoniccom.jpg
Transportín Vision Classic para Perro y/o Gato - Classic 50 ( 48x32x33cm ),14.90,http://www.petsonic.com/es/2613-large_default/nayeco-tanportin-vision-classic.jpg
Transportín Vision Classic para Perro y/o Gato - Classic 60 ( 59x39x41cm ),22.50,http://www.petsonic.com/es/2613-large_default/nayeco-tanportin-vision-classic.jpg
Transportin Traveller - Pequeño ( 50x34x35cm ),59.90,http://www.petsonic.com/es/2618-large_default/trixie-transportin-traveller.jpg
Transportin Traveller - Mediano ( 60x42x42cm ),69.70,http://www.petsonic.com/es/2618-large_default/trixie-transportin-traveller.jpg
Transportin Traveller - GRande ( 70x52x52cm ),84.20,http://www.petsonic.com/es/2618-large_default/trixie-transportin-traveller.jpg
Transportin Traveller - Extra Grande ( 81x58x58cm ),93.60,http://www.petsonic.com/es/2618-large_default/trixie-transportin-traveller.jpg
Transportin Traveller - Gigante (102x69x69cm ),118.50,http://www.petsonic.com/es/2618-large_default/trixie-transportin-traveller.jpg
Transportín Plegable Doble Vario para Perro - 91x60x61/57 cm.,109.95,http://www.petsonic.com/es/6158-large_default/transportin-doble-vario.jpg
Ruedas para Transportín Capri del I al III y Gulliver 3 - 4 Unidades.,5.10,http://www.petsonic.com/es/6181-large_default/4-ruedas-para-capri-del-i-al-iii-y-gulliver-3.jpg
Adaptador Cinturón de Seguridad Nylon para Perros - Amarillo,4.60,http://www.petsonic.com/es/5562-large_default/perros-adaptador-cinturon-seguridad-nylon-para-perros.jpg
Adaptador Cinturón de Seguridad Nylon para Perros - Negro,4.60,http://www.petsonic.com/es/5562-large_default/perros-adaptador-cinturon-seguridad-nylon-para-perros.jpg
Cinturón de Seguridad,6.04,
Adaptador de Cinturón de Seguridad para Coche - 70 cm.,5.45,http://www.petsonic.com/es/8188-large_default/perros-cinturon-seguridad.jpg
Cinturón de Seguridad para Coche - 40-60 cm,3.20,http://www.petsonic.com/es/8383-large_default/perros-cinturon-seguridad-para-coche.jpg
Cinturón de Seguridad para Coche - 45-70 cm,3.80,http://www.petsonic.com/es/8383-large_default/perros-cinturon-seguridad-para-coche.jpg
Acople Adaptador Rojo Cinturón de Seguridad Coche para Perro - S-M,4.40,http://www.petsonic.com/es/5647-large_default/perros-acople-adaptador-rojo-cinturon-seguridad-coche-para-perro.jpg
Acople Adaptador Rojo Cinturón de Seguridad Coche para Perro - L-XL,4.95,http://www.petsonic.com/es/5647-large_default/perros-acople-adaptador-rojo-cinturon-seguridad-coche-para-perro.jpg
Adaptador Cinturón de Seguridad para Coche - Negro,3.65,http://www.petsonic.com/es/8505-large_default/perros-adaptador-cinturon-seguridad-para-coche.jpg
Arnés de Seguridad Coche para Perros - S,10.45,http://www.petsonic.com/es/5586-large_default/perros-zolux-arnes-seguridad.jpg
Arnés de Seguridad Coche para Perros - M,12.50,http://www.petsonic.com/es/5586-large_default/perros-zolux-arnes-seguridad.jpg
Arnés de Seguridad Coche para Perros - L,13.10,http://www.petsonic.com/es/5586-large_default/perros-zolux-arnes-seguridad.jpg
Arnés de Seguridad Coche para Perros - XL,15.10,http://www.petsonic.com/es/5586-large_default/perros-zolux-arnes-seguridad.jpg
Rejilla Ventilación para Coches - 33 - 110 cm,6.65,http://www.petsonic.com/es/6182-large_default/trixie-rejilla-ventilacion-para-coches.jpg
Rejilla Ventilación para Coches - 24 - 70 cm,5.10,http://www.petsonic.com/es/6182-large_default/trixie-rejilla-ventilacion-para-coches.jpg
Rejilla Metálica de Seguridad para Coche - Ajustable,84.85,http://www.petsonic.com/es/6179-large_default/trixie-rejilla-seguridad-para-coche.jpg
Divisorio Metálico 2 Elementos para Coche - Ajustable,28.95,http://www.petsonic.com/es/6176-large_default/2890-trixie-divisorio-para-el-coche-metalico-ajustable.jpg
Barras Separadoras para Coche - Regulable,42.65,http://www.petsonic.com/es/7121-large_default/perros-barras-separadoras-para-coche.jpg
Divisorio Metálico 3 Elementos para Coche - Ajustable,34.70,http://www.petsonic.com/es/6178-large_default/2889-trixie-divisorio-para-el-coche-metalico-ajustable.jpg
Barra Protectora Coches - Ajustable,32.55,http://www.petsonic.com/es/5319-large_default/perros-barra-protectora-coches.jpg
Walky Barras Separadoras  de Coche - 140 x 45 cm,109.20,http://www.petsonic.com/es/7169-large_default/walky-barras-separadoras-de-coche.jpg
Walky Barras de Separación para Coche - 141 x 37 cm,82.25,http://www.petsonic.com/es/2397-large_default/dimac-bice-divisor-coche.jpg
Barra protectora Coches - 125-140 cm,48.65,http://www.petsonic.com/es/8388-large_default/perros-trixie-barra-protectora-coches.jpg
Zolux Funda Protectora Asientos para Coche - Talla Unica,10.14,http://www.petsonic.com/es/5708-large_default/zolux-funda-coche.jpg
Asiento Coche de Nylon para Perro - 45x38x37 cm.,45.75,http://www.petsonic.com/es/6167-large_default/perros-2901-trixie-asiento-coche.jpg
Funda Asiento Coche con Laterales - 1.45m x 0.65 cm,31.55,http://www.petsonic.com/es/6163-large_default/trixie-funda-asiento-coche-con-laterales.jpg
Funda Asiento Coche con Laterales - 1.50 x 1.35 cm,34.25,http://www.petsonic.com/es/6163-large_default/trixie-funda-asiento-coche-con-laterales.jpg
Funda Protectora Estampada para Asientos de Coche - 1.40 x 1.45 m,27.10,http://www.petsonic.com/es/6172-large_default/funda-protectora-estampada-para-asientos-de-coche.jpg
Funda Protectora para Asientos de Coche - Talla Unica,15.90,http://www.petsonic.com/es/5639-large_default/funda-protectora-para-asientos-de-coche.jpg
Funda Cubre Asientos - 162 x 132 cm,13.97,http://www.petsonic.com/es/8442-large_default/funda-cubre-asientos.jpg
Cubre asientos coche nylon - 1.60 x1.45 cm,37.25,http://www.petsonic.com/es/8384-large_default/trixie-cubre-asientos-coche-nylon.jpg
Funda Protectora Asiento Coche 1.40 m x1.20 m - 1.40 x 1.20 m,18.10,http://www.petsonic.com/es/6007-large_default/trixie-funda-asiento-coche.jpg
Protector Maletero - 1.64 x 1.25 m,39.80,http://www.petsonic.com/es/8385-large_default/2877-protector-maletero.jpg
Funda Protectora de Maletero - 2.30x1.70 cm,24.75,http://www.petsonic.com/es/8386-large_default/funda-protectora-de-maletero.jpg
Funda Protección para Maletero - 1.50 x 1.20 m,20.65,http://www.petsonic.com/es/8387-large_default/funda-protecion-para-maletero.jpg
Rampa Plástico Petwalk para Perro - 156x40x8 cm,86.20,http://www.petsonic.com/es/6202-large_default/rampa-plastico-petwalk-40x156x8-cm.jpg
Rampa de Aluminio para Perros - 155x38 cm,126.50,http://www.petsonic.com/es/6203-large_default/rampa-aluminio.jpg
Bolso de Transporte Little King of Dogs para Perro - 25x17x12 cm,18.40,http://www.petsonic.com/es/6134-large_default/perros-bolso-transporte-little-king-of-dogs-para-perro.jpg
Bolso de Transporte Little King of Dogs para Perro - 30x20x14 cm.,20.25,http://www.petsonic.com/es/6134-large_default/perros-bolso-transporte-little-king-of-dogs-para-perro.jpg
Bolso King of Dogs Color Negro para Perro. - 41x30x21 cm,43.40,http://www.petsonic.com/es/6123-large_default/perros-bolso-king-of-dogs-color-negro-para-perro.jpg
Bolso de Transporte Silvia para Perro y/o Gato - 42x29x19 cm,58.95,http://www.petsonic.com/es/6146-large_default/gatos-bolso-transporte-mod-silvia-para-perro-yo-gato.jpg
Bolso de Transporte Acolchado Amina para Perro y Gato - Negro,34.35,http://www.petsonic.com/es/6014-large_default/gatos-bolso-transporte-acolchado-mod-amina-para-perro.jpg
Bolso de Transporte Nane para Perro - 56x32x26 cm,36.15,http://www.petsonic.com/es/6143-large_default/perros-bolso-transporte-mod-nane-para-perro.jpg
Bolso de Transporte Tote para Perro y Gato - Negro,32.30,http://www.petsonic.com/es/5747-large_default/gatos-bolso-transporte-tote-para-perro-gato.jpg
Bolso de Transporte Tote para Perro y Gato - Rosa,32.30,http://www.petsonic.com/es/5747-large_default/gatos-bolso-transporte-tote-para-perro-gato.jpg
Bolso de Transporte Take Me With You para Perro - Marron,37.45,http://www.petsonic.com/es/5772-large_default/gatos-mochila-transporte-acolchado-para-perro-gato.jpg
Bolso de Transporte Take Me With You para Perro - Rosa,37.45,http://www.petsonic.com/es/5772-large_default/gatos-mochila-transporte-acolchado-para-perro-gato.jpg
Bolso de Transporte Acolchado para Perro y Gato - Azul,33.15,http://www.petsonic.com/es/5774-large_default/gatos-bolso-transporte-acolchado-para-perro-gato.jpg
Bolso de Transporte Acolchado para Perro y Gato - Rojo,33.15,http://www.petsonic.com/es/5774-large_default/gatos-bolso-transporte-acolchado-para-perro-gato.jpg
Troley Mochila Acolchado para Perro y Gato - Mediano,66.80,http://www.petsonic.com/es/5775-large_default/troley-mochila-acolchado-para-perro-y-gato.jpg
Troley Mochila Acolchado para Perro y Gato - Grande,86.95,http://www.petsonic.com/es/5775-large_default/troley-mochila-acolchado-para-perro-y-gato.jpg
Bolso de Transporte Sissy para Perro y/o Gato - 50x31x20 cm,68.95,http://www.petsonic.com/es/6147-large_default/gatos-bolsa-sissy.jpg
Mochila Frontal Savina para Perro y/o Gato. - 30x33x26 cm,28.30,http://www.petsonic.com/es/6125-large_default/mochila-frontal-savina.jpg
Transportín Multifunción para Perro y Gato - Talla Unica,55.10,http://www.petsonic.com/es/5767-large_default/transportin-multifuncion-para-perro-y-gato.jpg
Bolsa de Transporte Multifunción para Perro y Gato - Talla Unica,59.85,http://www.petsonic.com/es/5769-large_default/gatos-bolsa-transporte-multifuncion-para-perro-gato.jpg
Mochila de Transporte Multifunción para Perro y Gato - Talla Unica,46.75,http://www.petsonic.com/es/5765-large_default/mochila-de-transporte-multifuncion-para-perro-y-gato.jpg
Bolsa Transportin Adriana para Perro y/o Gato - 42x27x26 cm,26.70,http://www.petsonic.com/es/6129-large_default/gatos-2863-bolsa-transp.jpg
Bolso de Transporte Elisa para Perro y/o Gato - 41x26x20 cm,18.57,http://www.petsonic.com/es/6140-large_default/gatos-bolso-transporte-modelisa-para-perro-yo-gato.jpg
Bolso de Transporte Fiona para Perro y/o Gato - 40x25x18 cm,20.95,http://www.petsonic.com/es/6141-large_default/gatos-bolsa-fiona.jpg
Bolso de Transporte Jaime para Perro y/o Gato. - 46x28x26 cm,24.65,http://www.petsonic.com/es/6015-large_default/gatos-bolso-transporte-mod-jamie-para-perro-yo-gato.jpg
Bolso de Transporte Jaime para Perro y/o Gato. - 52x30x30 cm,28.60,http://www.petsonic.com/es/6015-large_default/gatos-bolso-transporte-mod-jamie-para-perro-yo-gato.jpg
Bolso de Transporte Ryan para Perro y/o Gato. - 47x28x26 cm,21.15,http://www.petsonic.com/es/6018-large_default/gatos-bolso-transporte-mod-ryan-para-perro-yo-gato.jpg
Bolso de Transporte Ryan para Perro y/o Gato. - 54x30x30 cm,22.65,http://www.petsonic.com/es/6018-large_default/gatos-bolso-transporte-mod-ryan-para-perro-yo-gato.jpg
Bolsa Transporte Holly para Perro y/o Gato - 50x30x30 cm,52.85,http://www.petsonic.com/es/6124-large_default/gatos-bolsa-holly.jpg
Bolsa Transportin Alina para Perros y/o Gato - Antracita-Burdeos,32.95,http://www.petsonic.com/es/6128-large_default/gatos-bolsa-alina.jpg
Mochila de Transporte Nelly para Perro y/o Gato - 34x32x29 cm,28.25,http://www.petsonic.com/es/6149-large_default/mochila-nelly.jpg
Mochila Transporte Shiva para Perro y/o Gato - 41x30x21 cm,33.75,http://www.petsonic.com/es/6150-large_default/mochilla-shiva-nylon.jpg
Mochila Transporte Connor para Perro y Gato. - 44x30x21 cm,20.75,http://www.petsonic.com/es/6138-large_default/mochila-connor.jpg
Mochila de Transporte Timon para Perro y/o Gato - 44x34x30 cm,49.95,http://www.petsonic.com/es/6151-large_default/mochila-timon.jpg
Mochila Trolley Transporte Elegance para Perro y/o Gato - 45x41x31 cm.,74.95,http://www.petsonic.com/es/6152-large_default/trolley-elegance.jpg
Mochila Trolley Transporte para Perro y/o Gato - 50x36x27 cm,43.40,http://www.petsonic.com/es/6154-large_default/trolley-mochilla-perro.jpg
Carrito de Paseo para Perro - Talla Unica,92.50,http://www.petsonic.com/es/5759-large_default/perros-carrito-paseo-para-perro.jpg
Kit Combo Transportin y Troley para Perro - Talla Unica,158.60,http://www.petsonic.com/es/5760-large_default/kit-combo-transportin-y-troley-para-perro.jpg
Bebedero Portatil Aqua Boy - 0.500 L,5.50,http://www.petsonic.com/es/2958-large_default/perros-wuapu-bebedero-portatil-aqua-boy.jpg
Bebedero Portatil Aqua Boy - 0.800 L,7.30,http://www.petsonic.com/es/2958-large_default/perros-wuapu-bebedero-portatil-aqua-boy.jpg
Bebedero Viaje con Botella para Perro Colores Variados. - 0.250 L,3.35,http://www.petsonic.com/es/5907-large_default/perros-trixie-bebedero-viaje-botella.jpg
Bebedero Viaje con Botella para Perro Colores Variados. - 0.500 L,4.20,http://www.petsonic.com/es/5907-large_default/perros-trixie-bebedero-viaje-botella.jpg
Bebedero Viaje con Botella para Perro Colores Variados. - 0.700 L,4.65,http://www.petsonic.com/es/5907-large_default/perros-trixie-bebedero-viaje-botella.jpg
Comedero Viaje Silicona - 0.500 L,3.50,http://www.petsonic.com/es/2323-large_default/trixie-comedero-viaje-silicona.jpg
Comedero Viaje Silicona - 1 L,4.95,http://www.petsonic.com/es/2323-large_default/trixie-comedero-viaje-silicona.jpg
Bebedero Nylon Plegable para Viaje - 1.8 L,2.55,http://www.petsonic.com/es/5935-large_default/perros-bebedero-viaje.jpg
Comedero-bebedero de Viaje Plegable. - 1.1 L - 1.4 L,9.50,http://www.petsonic.com/es/5951-large_default/trixie-comedero-bebedero-viaje.jpg
Adaptil Comprimidos - 10 Unidades.,8.95,http://www.petsonic.com/es/6357-large_default/perros-adaptil-comprimidos-10unid-perros.jpg
Adaptil Spray - 60 ml,14.75,http://www.petsonic.com/es/7817-large_default/perros-adaptil-spray.jpg
Ambientador Especial Mascotas para Coche - 15 ml,4.95,http://www.petsonic.com/es/8446-large_default/perros-ambientador-especial-mascotas-para-coche.jpg
